{
  "schema_version": 2,
  "product": "DOC_RED",
  "version": "3.6.36",
  "min_supported_version": "3.6.35",
  "download_url": "https://github.com/itsrolands/DOC_RED-releases/releases/download/v3.6.36/DOC_RED.exe",
  "update_policy": "optional",
  "release_state": "published",
  "release_channel": "stable",
  "release_notes": "DOC_RED v3.6.36 released automatically from Conventional Commits.",
  "message": "A new DOC_RED release is being prepared.",
  "support_url": "https://github.com/itsrolands/DOC_RED-releases",
  "published_at": "generated-by-authoritative-workflow",
  "signature_required": true,
  "sha256": "b9d9564e028eafc7d30d9e78ed9cf50c3519c53d7b51be32459918b5078a6f61",
  "size_bytes": 171912460,
  "signature": "oRzaGy74z0UzON1VFr+s9z/vLs1kVv/1TqpPT5qAJ0Lrx/TLMJnYS9Cc8h4rY/EojCGM0bvs9NyQMsLToY3SYw8RBybOYBUeibiLhjOcShhxGOfwzRkezzgFozO/+ZNX2qEG/eWm7nPr4NYxiVITQ4zwNYHlPaVWdDD+vTMYTNWKe8wO0o7FfiKVapoZGxm8ncfmg8JyqD9dHNcTBWT+gWUZW9D3oqKBlXz7qPytkcQG2x56eUsbFyh5UMOGhuwVxrvZdHtt0eHXUvdvAhSrWWGDolbiSil8L1xBRpscj3ZCmD22zYZPdBcP4e/aPlQz1mLHAoNKXGVBrfZxW963NA=="
}
